{
  "doc_id": "01_normalized_AUTOSAR_AP_SWS_TimeSynchronization",
  "checks": {
    "item_id_count": 258,
    "unique_item_id_count": 185,
    "duplicate_item_ids": [
      "[SWS_TS_00041]",
      "[SWS_TS_00043]",
      "[SWS_TS_00045]",
      "[SWS_TS_00046]",
      "[SWS_TS_00047]",
      "[SWS_TS_00048]",
      "[SWS_TS_00049]",
      "[SWS_TS_00050]",
      "[SWS_TS_00052]",
      "[SWS_TS_00053]",
      "[SWS_TS_00054]",
      "[SWS_TS_00055]",
      "[SWS_TS_00062]",
      "[SWS_TS_00064]",
      "[SWS_TS_00071]",
      "[SWS_TS_00120]",
      "[SWS_TS_00127]",
      "[SWS_TS_00202]",
      "[SWS_TS_00212]",
      "[SWS_TS_00214]",
      "[SWS_TS_00215]",
      "[SWS_TS_00420]",
      "[SWS_TS_00421]",
      "[SWS_TS_00422]",
      "[SWS_TS_00423]",
      "[SWS_TS_00424]",
      "[SWS_TS_00425]",
      "[SWS_TS_00426]",
      "[SWS_TS_00427]",
      "[SWS_TS_00902]",
      "[SWS_TS_00903]",
      "[SWS_TS_00909]",
      "[SWS_TS_01002]",
      "[SWS_TS_01005]",
      "[SWS_TS_01006]",
      "[SWS_TS_01010]",
      "[SWS_TS_01012]",
      "[SWS_TS_01014]",
      "[SWS_TS_01015]",
      "[SWS_TS_01018]",
      "[SWS_TS_01056]",
      "[SWS_TS_01057]",
      "[SWS_TS_01058]",
      "[SWS_TS_01061]",
      "[SWS_TS_01102]",
      "[SWS_TS_01103]",
      "[SWS_TS_01104]",
      "[SWS_TS_01105]",
      "[SWS_TS_01106]",
      "[SWS_TS_01201]",
      "[SWS_TS_01202]",
      "[SWS_TS_01203]",
      "[SWS_TS_01204]",
      "[SWS_TS_01205]",
      "[SWS_TS_01206]",
      "[SWS_TS_01207]",
      "[SWS_TS_01209]",
      "[SWS_TS_01403]",
      "[SWS_TS_14181]",
      "[SWS_TS_14183]",
      "[SWS_TS_14184]",
      "[SWS_TS_14185]",
      "[SWS_TS_14186]",
      "[SWS_TS_14198]",
      "[SWS_TS_14199]",
      "[SWS_TS_14200]",
      "[SWS_TS_14202]",
      "[SWS_TS_14203]",
      "[SWS_TS_14205]",
      "[SWS_TS_14212]",
      "[SWS_TS_14213]",
      "[SWS_TS_14223]",
      "[SWS_TS_14229]"
    ],
    "sections_count": 279,
    "unique_section_count": 274,
    "duplicate_sections": [
      "2.2.1 ara::core::SteadyClock",
      "8.6.3.1.2 kMaxUserDataSize",
      "8.7.1.1.7 timeBaseStatus",
      "8.8.1.1.7 responseReceiptTimestamp",
      "8.8.3.1.3 syncEgressTimestamp"
    ],
    "table_layout_lines": 0,
    "total_lines": 3681
  },
  "score": 0.8798,
  "pass": true
}